book,chapter,id,problem,translation,answer,value,expression,algorithm_id,hint
九章算术,卷第五　商功,〔七〕,今有穿渠上广一丈八尺，下广三尺六寸，深一丈八尺，袤五万一千八百二十四尺。问︰积几何？秋程人功三百尺，问︰用徒几何？一千人先到，问︰当受袤几何？,现在有一条渠道，上宽一丈八尺，下宽三尺六寸，深一丈八尺，渠道长约五万一千八百二十四尺。问这个渠道的容积是多少？秋程人均能完成三百尺，请问这个工程的用徒需要多少？一千人已经先到了，应该分配的长度是多少？,一千七万四千五百八十五尺六寸。三万三千五百八十二人功。内少一十四尺四寸。一百五十四丈三尺二寸、八十一分寸之八。,,,26,以一人功尺数，乘先到人数为实。并渠上下广而半之，以深乘之为法。实如法得袤尺。
九章算术,卷第五　商功,〔八〕,今有方堡壔方一丈六尺，高一丈五尺。问︰积几何？,现在有一个体积为一丈六尺的正方形堡壔，高度为一丈五尺。问这个堡壔的面积是多少？,三千八百四十尺。,,,26,方自乘，以高乘之，即积尺。
九章算术,卷第五　商功,〔九〕,今有圆堡壔，周四丈八尺，高一丈一尺。问︰积几何？,现在有一个圆形的堡垒，周长为四丈八尺，高度为一丈一尺。问这个堡垒的体积是多少？,二千一百一十二尺。,,,26,周自相乘，以高乘之，十二而一。
九章算术,卷第五　商功,〔一〇〕,今有方亭，下方五丈，上方四丈，高五丈。问︰积几何？,现在有一个方形亭子，下面边长五丈，上面边长四丈，高度五丈。问这个亭子的体积是多少？,一十万一千六百六十六尺、太半尺。,,,26,上下方相乘，又各自乘，并之，以高乘之，三而一。
九章算术,卷第五　商功,〔一一〕,今有圆亭，下周三丈，上周二丈，高一丈。问︰积几何？,现在有一个圆形亭子，下圆周长三丈，上圆周长二丈，高一丈。问这个亭子的体积是多少？,五百二十七尺、九分尺之七。,,,26,上、下周相乘，又各自乘，并之，以高乘之，三十六而一。
九章算术,卷第五　商功,〔一二〕,今有方锥下方二丈七尺，高二丈九尺。问︰积几何？,现在有一个方锥，底部边长为二丈九尺，高为二丈九尺。问这个体积是多少？,七千四十七尺。,,,26,下方自乘，以高乘之，三而一。
九章算术,卷第五　商功,〔一三〕,今有圆锥下周三丈五尺，高五丈一尺。问︰积几何？,现在有一个圆锥，它的底部周长三丈五尺，高度为五丈一尺。问这个圆锥的体积是多少？,一千七百三十五尺、一十二分尺之五。,,,26,下周自乘，以高乘之，三十六而一。
九章算术,卷第五　商功,〔一四〕,今有堑堵下广二丈，袤一十八丈六尺，高二丈五尺。问︰积几何？,现在有一堑堵，渠底宽度为二丈，渠长为十八丈六尺，渠高为二丈五尺。问这个沟渠的容积是多少？,四万六千五百尺。,,,26,广袤相乘，以高乘之，二而一。
九章算术,卷第五　商功,〔一五〕,今有阳马，广五尺，袤七尺，高八尺。问︰积几何？,现在有一阳马，宽为五尺，长度为七尺，高度为八尺。请问它的体积是多少？,九十三尺、少半尺。,,,26,广袤相乘，以高乘之，三而一。
九章算术,卷第五　商功,〔一六〕,今有鳖臑下广五尺，无袤，上袤四尺，无广，高七尺。问︰积几何？,现在有一鳖臑，其底部宽为五尺，没有长度，上部长度为四尺，没有宽度，高度为七尺。问它的体积是多少？,二十三尺、少半尺。,,,26,广袤相乘，以高乘之，六而一。
九章算术,卷第五　商功,〔一七〕,今有羡除，下广六尺，上广一丈，深三尺，末广八尺，无深，袤七尺。问︰积几何？,现在有一羡除，下宽六尺，上宽一丈，深三尺，末尾宽八尺，没有深，长约七尺。问这个羡的容积是多少？,八十四尺。,,,26,并三广，以深乘之，又以袤乘之，六而一。
九章算术,卷第五　商功,〔一八〕,今有刍甍，下广三丈，袤四丈，上袤二丈，无广，高一丈。问︰积几何？,现在有一刍甍，下面宽度为三丈、长度为四丈、上面长度为二丈的，没有宽度，高度为高一丈。问这个刍甍的体积是多少？,五千尺。,,,27,
九章算术,卷第五　商功,〔一九〕,今有刍童，下广二丈，袤三丈，上广三丈，袤四丈，高三丈。问︰积几何？,现在有一刍童，它的下宽是两丈，长是三丈，上宽是三丈，长是四丈，高是三丈。问它的体积是多少？,二万六千五百尺。,,,27,
九章算术,卷第五　商功,〔二〇〕,今有曲池，上中周二丈，外周四丈，广一丈，下中周一丈四尺，外周二丈四尺，广五尺，深一丈。问︰积几何？,现在有一曲池，上面内圆周二丈，外圆周四丈，宽一丈，下面内圆周一丈四尺，外圆周二丈四尺，宽五尺，深一丈。问池塘的容积是多少？,一千八百八十三尺三寸、少半寸。,,,27,
九章算术,卷第五　商功,〔二一〕,今有盘池，上广六丈，袤八丈，下广四丈，袤六丈，深二丈。问︰积几何？负土往来七十步，其二十步上下棚除。棚除二当平道五，踟蹰之间十加一，载输之间三十步，定一返一百四十步。土笼积一尺六寸，秋程人功行五十九里半。问︰人到、积尺、用徒各几何？,现在有一盘池，它的上面宽度是六丈，上面长度是八丈，下面宽度是四丈，下面长度是六丈，池深二丈。请问这个池的容积是多少？背土来回需要七十步，其中二十步是在上坡。在坡上二步等于平路五步，休息的十加一，装载输运需要三十步，一次往返为一百四十步。土笼容积一尺六寸。秋程人功为五十九里半。问：每人输运的体积和用徒各是多少？,七万六百六十六尺、太半尺。人到二百四尺。用徒三百四十六人、一百五十三分人之六十二。,,,27,以一笼积尺乘程行步数为实。往来上下，棚除二当平道五。置定往来步数，十加一，及载输之间三十步以为法。除之，所得即一人所到尺。以所到约积尺，即用徒人数。
九章算术,卷第五　商功,〔二二〕,今有冥谷上广二丈，袤七丈，下广八尺，袤四丈，深六丈五尺。问︰积几何？载土往来二百步，载输之间一里，程行五十八里，六人共车，车载三十四尺七寸。问︰人到积尺及用徒各几何？,现在有冥谷，其上宽二丈，长七丈，下宽八尺，长四丈，深六丈五尺。问：这个冥谷容积是多少？装载土需要走二百步，输运需要走一里路，总路程五十八里路，六个人一辆车，车的容量三十四尺七寸。问：这些人均运到土的积尺和用徒各是多少？,五万二千尺。人到二百一尺、五十分尺之十三。用徒二百五十八人、一万六十三分人之三千七百四十六。,,,27,以一车积尺乘程行步数为实。置今往来步数，加载输之间一里，以车六人乘之，为法。除之，所得即一人所到尺。以所到约积尺，即用徒人数。
九章算术,卷第五　商功,〔二三〕,今有委粟平地，下周一十二丈，高二丈。问︰积及为粟几何？,现在将粟堆在平地上，下圆周长十二丈，高二丈。问这个体积是多少？以及这个粟的总量多少？,积八千尺。为粟二千九百六十二斛、二十七分斛之二十六。,,,28,
九章算术,卷第五　商功,〔二四〕,今有委菽依垣，下周三丈，高七尺。问︰积及为菽各几何？,现在将菽靠一面墙边堆放，下圆周长三丈，高度为七尺。请问菽的体积是多少？菽的总量是多少？,积三百五十尺。为菽一百四十四斛、二百四十三分斛之八。,,,28,
九章算术,卷第五　商功,〔二五〕,今有委米依垣内角，下周八尺，高五尺。问︰积及为米几何？,现在将米放在城墙角处，下圆周长为八尺，高度为五尺。问这个体积是多少？米的总量是多少？,积三十五尺、九分尺之五。为米二十一斛，七百二十九分斛之六百九十一。,,,28,
九章算术,卷第五　商功,〔二六〕,今有穿地，袤一丈六尺，深一丈，上广六尺，为垣积五百七十六尺。问︰穿地下广几何？,现在有一出穿地，长一丈六尺，深一丈，上部宽六尺，土垣体积五百七十六尺。问：穿地的下宽是多少？,三尺、五分尺之三。,,,27,置垣积尺，四之为实。以深、袤相乘，又三之，为法。所得倍之，减上广，馀即下广。
九章算术,卷第五　商功,〔二七〕,今有仓广三丈，袤四丈五尺，容粟一万斛。问︰高几何？,现在有一个粮仓，宽是三丈，长四丈五尺，可以容纳一万斛的粮食。问粮仓的高度是多少？,二丈。,,,27,置粟一万斛积尺为实。广袤相乘为法。实如法而一，得高尺。
九章算术,卷第五　商功,〔二八〕,今有圆困，高一丈三尺三寸、少半寸，容米二千斛。问︰周几何？,现在有一个圆困，高是一丈三尺三又少半寸，可以容纳两千斛的米。问：它的圆周长是多少？,五丈四尺。,,,27,置米积尺，以十二乘之，令高而一，所得，开方除之，即周。
九章算术,		卷第六　均输,〔一〕,今有均输粟： 甲县一万户，行道八日；乙县九千五百户，行道十日；丙县一万二千三百五十户，行道十三日；丁县一万二千二百户，行道二十日，各到输所。凡四县赋，当输二十五万斛，用车一万乘。欲以道里远近，户数多少，衰出之。问︰粟、车各几何？,现在有一个均输粟的运粮规定：甲县有一万一千户，需要经过八天的道路行驶；乙县有九千五百户，需要经过十日的道路行驶；丙县有一万两千三百五十户，需要经过十三天的道路行驶；丁县有一万两千二百户，需要经过二十天的道路行驶，各自的粮食送到指定的仓库。四县总共需要运送二十五万斛的粮食，需要用车一万乘。如果想要根据道路的远近和户数的多少按比例确定粟和车的数量，请问粟和车的数量各是多少？,甲县粟八万三千一百斛，车三千三百二十四乘。乙县粟六万三千一百七十五斛，车二千五百二十七乘。丙县粟六万三千一百七十五斛，车二千五百二十七乘。丁县粟四万五百五十斛，车一千六百二十二乘。,,,29,令县户数，各如其本行道日数而一，以为衰。甲衰一百二十五，乙、丙衰各九十五，丁衰六十一，副并为法。以赋粟、车数乘未并者，各自为实。实如法得一车。有分者，上下辈之。以二十五斛乘车数，即粟数。
九章算术,		卷第六　均输,〔二〕,今有均输卒：甲县一千二百人，薄塞；乙县一千五百五十人，行道一日；丙县一千二百八十人，行道二日；丁县九百九十人，行道三日；戊县一千七百五十人，行道五日。凡五县，赋输卒一月一千二百人。欲以远近、户率，多少衰出之。问︰县各几何？,现在有五个县需要输运兵卒，甲县一千二百人，离要塞很近；乙县一千五百五十人，路程一天；丙县一千二百八十人，路程二日；丁县九百九十人，路程三日；戊县一千七百五十人，路程五日。五县需要输送一月一千二百人。想根据距离的远近、居民人口的多少来派遣这些人。请问这些县分别需要出多少人？,甲县二百二十九人。乙县二百八十六人。丙县二百二十八人。丁县一百七十一人。戊县二百八十六人。,,,29,令县卒，各如其居所及行道日数而一，以为衰。甲衰四，乙衰五，丙衰四，丁衰三，戊衰五，副并为法。以人数乘未并者各自为实。实如法而一。有分者，上下辈之。
九章算术,		卷第六　均输,〔三〕,今有均赋粟：甲县二万五百二十户，粟一斛二十钱，自输其县；乙县一万二千三百一十二户，粟一斛一十钱，至输所二百里；丙县七千一百八十二户，粟一斛一十二钱，至输所一百五十里；丁县一万三千三百三十八户，粟一斛一十七钱，至输所二百五十里；戊县五千一百三十户，粟一斛一十三钱，至输所一百五十里。凡五县赋，输粟一万斛。一车载二十五斛，与僦一里一钱。欲以县户输粟，令费劳等。问︰县各粟几何？,现在进行均赋粮食：甲县有二万五百二十户，粟一斛二十钱，甲县是运送粮食的目的地；乙县有一万二千三百一十二户，粟每斛十钱，距离甲县二百里；丙县有七千一百八十二户，粟每斛十二钱，距离甲县一百五十里；丁县有一万三千三百三十八户，粟每斛十七钱，距离甲县二百五十里；戊县有五千一百三十户，粟每斛十三钱，距离甲县一百五十里。五县的赋税，需要运送粟一万斛。每辆车运送二十五斛，运输成本每里一钱。想根据县户数运送粮食，费用等相同。问：甲县、乙县、丙县、丁县、戊县各运送的粮食是多少？,甲县三千五百七十一斛、二千八百七十三分斛之五百一十七。乙县二千三百八十斛、二千八百七十三分斛之二千二百六十。丙县一千三百八十八斛、二千八百七十三分斛之二千二百七十六。丁县一千七百一十九斛、二千八百七十三分斛之一千三百一十三。戊县九百三十九斛、二千八百七十三分斛之二千二百五十三。,,,29,以一里僦价，乘至输所里，以一车二十五斛除之，加一斛粟价，则致一斛之费。各以约其户数，为衰。甲衰一千二十六，乙衰六百八十四，丙衰三百九十九，丁衰四百九十四，戊衰二百七十，副并为法。所赋粟乘未并者，各自为实。实如法得一。
九章算术,		卷第六　均输,〔四〕,今有均赋粟， 甲县四万二千算，粟一斛二十，自输其县；乙县三万四千二百七十二算，粟一斛一十八，佣价一日一十钱，到输所七十里；丙县一万九千三百二十八算，粟一斛一十六，佣价一日五钱，到输所一百四十里；丁县一万七千七百算，粟一斛一十四，佣价一日五钱，到输所一百七十五里；戊县二万三千四十算，粟一斛一十二，佣价一日五钱，到输所二百一十里；己县一万九千一百三十六算，粟一斛一十，佣价一日五钱，到输所二百八十里。凡六县赋粟六万斛，皆输甲县。六人共车，车载二十五斛，重车日行五十里，空车日行七十里，载输之间各一日。粟有贵贱，佣各别价，以算出钱，令费劳等。问︰县各粟几何？,现在按照公平赋税上交粟，甲县有四万二千算，每斛粟二十钱，不需要运输；乙县有三万四千二百七十二算，每斛粟十八钱，运粮佣金每日十钱，运输距离为七十里；丙县有一万九千三百二十八算，每斛粟十六钱，运粮佣金每日五钱，运输距离为一百四十里；丁县有一万七千七百算，每斛粟十四钱，运粮佣金每日五钱，运输距离为一百七十五里；戊县有二万三千四十算，每斛粟十二钱，运粮佣金每日五钱，运输距离为二百一十里；己县有一万九千一百三十六算，每斛粟十钱，运粮佣金每日五钱，运输距离为二百八十里。所有六县的赋税粮食共计六万斛，全部运输到甲县。六个人共用一辆车，车载二十五斛，重车每日行驶五十里，空车每日行驶七十里，载货之间各一日。粮食有贵贱，佣金也有高低，按照不同县的算数比例出钱，使税收和劳动力等值。请问，各县需要出多少粟？,甲县一万八千九百四十七斛、一百三十三分斛之四十九。乙县一万八百二十七斛、一百三十三分斛之九。丙县七千二百一十八斛、一百三十三分斛之六。丁县六千七百六十六斛、一百三十三分斛之一百二十二。戊县九千二十二斛、一百三十三分斛之七十四。己县七千二百一十八斛、一百三十三分斛之六。,,,29,以车程行空、重相乘为法，并空、重以乘道里，各自为实，实如法得一日。加载输各一日，而以六人乘之，又以佣价乘之，以二十五斛除之，加一斛粟价，即致一斛之费。各以约其算数为衰，副并为法，以所赋粟乘未并者，各自为实。实如法得一斛。
九章算术,		卷第六　均输,〔五〕,今有粟七斗，三人分舂之，一人为粝米，一人为粺米，一人为凿米，令米数等。问︰取粟为米各几何？,现在有七斗粟，三个人负责舂米，一人负责制作粝米，一人负责制作粺米，一人负责制作凿米，使得米数量相等。问：每个人分到的粟米数量各是多少？,粝米取粟二斗、一百二十一分斗之一十。粺米取粟二斗、一百二十一分斗之三十八。凿米取粟二斗、一百二十一分斗之七十三。为米各一斗、六百五分斗之一百五十一。,,,29,列置粝米三十，粺米二十七，凿米二十四，而反衰之，副并为法。以七斗乘未并者，各自为取粟实。实如法得一斗。若求米等者，以本率各乘定所取粟为实，以粟率五十为法，实如法得一斗。
九章算术,		卷第六　均输,〔六〕,今有人当禀粟二斛。仓无粟，欲与米一、菽二，以当所禀粟。问︰各几何？,现在有人要领取二斛粟，但是粮仓没有粟了，想要用米和菽以一比二替代所分发的粟。请问需要米和菽各多少？,米五斗一升、七分升之三。菽一斛二升、七分升之六。,,,29,置米一、菽二求为粟之数。并之得三、九分之八，以为法。亦置米一、菽二，而以粟二斛乘之，各自为实。实如法得一斛。
九章算术,		卷第六　均输,〔七〕,今有取佣负盐二斛，行一百里，与钱四十。今负盐一斛七斗三升、少半升，行八十里。问︰与钱几何？,现在有一个人跑腿，带着两斛盐，走了一百里，需付四十元钱。现在他带着一斛七斗三又少半升的盐，走了八十里。问该给的钱是多少？,二十七钱、十五分钱之十一。,,,29,置盐二斛升数，以一百里乘之为法。以四十钱乘今负盐升数，又以八十里乘之，为实。实如法得一钱。
九章算术,		卷第六　均输,〔八〕,今有负笼重一石一十七斤，行七十六步，五十返。今负笼重一石，行百步，问︰返几何？,现在背一笼重一石十七斤，需要走七十六步，共能返回五十次。现在把这个笼子装重一石，走一百步，问可返回的次数是多少？,四十三返、六十分返之二十三。,,,29,以今所行步数乘今笼重斤数为法，故笼重斤数乘故步，又以返数乘之，为实。实如法得一返。
九章算术,		卷第六　均输,〔九〕,今有程传委输，空车日行七十里，重车日行五十里。今载太仓粟输上林，五日三返。问︰太仓去上林几何？,现在有一个运输路线，名叫“程传委输”，空车每天可以行驶七十里，重车每天可以行驶五十里。现在他们将太仓的粮食运输到上林，为期五天完成三个来回。那么，太仓到上林的距离是多少？,四十八里、十八分里之十一。,,,29,并空、重里数，以三返乘之，为法。令空、重相乘，又以五日乘之，为实。实如法得一里。
九章算术,		卷第六　均输,〔一〇〕,今有络丝一斤为练丝一十二两，练丝一斤为青丝一斤十二铢。今有青丝一斤，问︰本络丝几何？,现在有一斤络丝，制成练丝十二两，一斤练丝可以制成青丝一斤十二铢，现在有一斤青丝，请问原本的络丝需要多少？,一斤四两一十六铢、三十三分铢之十六。,,,29,以练丝十二两乘青丝一斤一十二铢为法。以青丝一斤铢数乘练丝一斤两数，又以络丝一斤乘之，为实。实如法得一斤。
九章算术,		卷第六　均输,〔一一〕,今有恶粟二十斗，舂之，得粝米九斗。今欲求粺米十斗，问︰恶粟几何？,现在有二十斗不好的粟，经过舂米后，只得到九斗粝米。如果想要得到十斗粺米，那么请问需要不好的粟是多少？,二十四斗六升、八十一分升之七十四。,,,29,置粝米九斗，以九乘之，为法。亦置粺米十斗，以十乘之，又以恶粟二十斗乘之，为实。实如法得一斗。
九章算术,		卷第六　均输,〔一二〕,今有善行者行一百步，不善行者行六十步。今不善行者先行一百步，善行者追之，问︰几何步及之？,现在，一个善于走路的人每走一百步，而一位不善走的人只能走六十步。现在不善走的人先走了一百步，善行的人追上去，问：“走多少步才能追上？”,二百五十步。,,,29,置善行者一百步，减不善行者六十步，馀四十步，以为法。以善行者之一百步，乘不善行者先行一百步，为实。实如法得一步。
九章算术,		卷第六　均输,〔一三〕,今有不善行者先行一十里，善行者追之一百里，先至不善行者二十里。问︰善行者几何里及之？,现在有一个不善行走的人先走了一十里，一个善于行走的人追了一百里，比不善行走的人先到且领先了二十里。问，善于行走者走了多少里追上的不善行走的人？,三十三里、少半里。,,,29,置不善行者先行一十里，以善行者先至二十里增之，以为法。以不善行者先行一十里，乘善行者一百里，为实。实如法得一里。
九章算术,		卷第六　均输,〔一四〕,今有兔先走一百步，犬追之二百五十步，不及三十步而止。问︰犬不止，复行几何步及之？,现在有一只兔子先跑了一百步，一只狗追了二百五步，最后追到还有三十步就停下来了。问：如果狗不停地追，狗还需要多少步才能追得到兔子？,一百七步、七分步之一。,,,29,置兔先走一百步，以犬走不及三十步减之，馀为法。以不及三十步乘犬追步数为实，实如法得一步。
九章算术,		卷第六　均输,〔一五〕,今有人持金十二斤出关。关税之，十分而取一。今关取金二斤，偿钱五千。问︰金一斤值钱几何？,现在有人带着十二斤金子出关，关税是十分之一。现在海关收取了二斤金子，还需要支付五千元的关税。问：金子一斤值多少钱？,六千二百五十。,,,29,以一十乘二斤，以十二斤减之，馀为法。以一十乘五千为实。实如法得一钱。
九章算术,		卷第六　均输,〔一六〕,今有客马日行三百里。客去忘持衣，日已三分之一，主人乃觉。持衣追及与之而还，至家视日四分之三。问︰主人马不休，日行几何？,现在客人的马每天行驶三百里。客人离开了，等太阳处于三分之一，主人才发现客人忘记带衣服。主人立即带上衣服去追赶客人，最终追上了将衣服还给客人，然后启程回家。等到主人回到家中，发现已经太阳已经处于四分之三。问：主人的马一直不休，每天行驶多少距离？,七百八十里。,,,29,置四分日之三，除三分日之一，半其馀以为法。副置法，增三分日之一，以三百里乘之，为实。实如法，得主人马一日行。
九章算术,		卷第六　均输,〔一七〕,今有金棰，长五尺。斩本一尺，重四斤。斩末一尺，重二斤。问︰次一尺各重几何？,现有一根五尺长的金棰，从头部斩断一寸有四斤的重量，从尾部斩断一寸有二斤的重量。问：金棰的每尺各有多少重量？,末一尺，重二斤。次一尺，重二斤八两。次一尺，重三斤。次一尺，重三斤八两。次一尺，重四斤。,,,29,令末重减本重，馀即差率也。又置本重，以四间乘之，为下第一衰。副置，以差率减之，每尺各自为衰。副置下第一衰以为法，以本重四斤遍乘列衰，各自为实。实如法得一斤。
九章算术,		卷第六　均输,〔一八〕,今有五人分五钱，令上二人所得与下三人等。问︰各得几何？,现在有五人分配五钱，让分的多的两人得分与分的少的三人总钱数相同。问每个人得到的钱数是多少？,甲得一钱、六分钱之二，乙得一钱、六分钱之一，丙得一钱，丁得六分钱之五，戊得六分钱之四。,,,29,置钱锥行衰，并上二人为九，并下三人为六。六少于九，三。以三均加焉，副并为法。以所分钱乘未并者各自为实。实如法得一钱。
