,problem,problem_ancient,problem_modern
784,问有上农三人力田所收之米系用足斗均分各徃他处岀粜甲粜本郡官塲余三斗二升乙粜与吉安乡民余七斗丙粜与平江戸余三斗欲知共米及三人所分各粜石几何,问：有上农三人，力田所收之米，系用足斗均分，各往他处出粜。甲粜本郡官场余三斗二升，乙粜与吉安乡民余七斗，丙粜与平江府户余三斗。欲知共米及三人所分各粜石几何？,这句话的现代汉语翻译是：问有三个农民，他们的田地所收获的米，用足斗均分后各自带到其他地方去卖，其中甲粜本郡官场余三斗二升，乙粜与吉安乡民余七斗，丙粜与平江户余三斗。想知道总共有多少米，以及每个人分到多少石。
785,问欲砌基一叚见管大小方砖六门城砖四色令匠取便或平或侧只用一色砖砌湏要适足匠以砖量地计料称用大方料广多六寸深少六寸【按即多七寸】用小方广多二寸深少三寸【按即多八寸】用城砖长广多三寸深少一寸【按即多一尺一寸】以阔深少一寸【按即多五寸】广多三寸以厚广多五分深多一寸用六门砖长广三寸深多一寸以阔广多三寸深多一寸用厚广多一寸深多一寸皆不匼匝未免修破砖料禆补其四色砖大方方一尺三寸小方方一尺一寸城砖长一尺二寸阔六寸厚二寸五分六门长一尺阔五寸厚二寸欲知基深广几何　　按题意谓以一尺三寸量基之广未余六寸以一尺一寸量之余二寸以一尺二寸量之余三寸以六寸量之亦余三寸以二寸五分量之余五分以一尺量之余三寸以五寸量之亦余三寸以二寸量之余一寸以求广也其求深之意亦同,问欲砌基一叚，见管大小方砖，六门城砖四色。令匠取便，或平或侧，只用一色砖砌。湏要适足，匠以砖量地计料，称用大方料广多六寸，深少六寸【按即多七寸】。用小方广多二寸，深少三寸【按即多八寸】。用城砖长广多三寸，深少一寸【按即多一尺一寸】，以阔深少一寸【按即多五寸】。广多三寸，以厚广多五分，深多一寸。用六门砖，长广三寸，深多一寸，以阔广多三寸，深多一寸，用厚广多一寸，深多一寸。皆不匼匝，未免修破。砖料禆补，其四色砖大方方一尺三寸，小方方一尺一寸，城砖长一尺二寸，阔六寸，厚二寸五分，六门长一尺，阔五寸，厚二寸。欲知基深广几何？按题意谓以一尺三寸量基之广未余六寸，以一尺一寸量之余二寸，以一尺二寸量之余三寸，以六寸量之亦余三寸，以二寸五分量之余五分，以一尺量之余三寸，以五寸量之亦余三寸，以二寸量之余一寸，以求广也。其求深之意亦同。,这段古文的意思是：问想要砌一座基础，看到管大小的方砖，有六门城砖，四种颜色。让工匠取便，或平或侧，只用一种颜色的砖砌。要求砌出来的基础要适合，工匠要根据地面的大小计算需要用多少砖。用大方的砖，广多六寸，深少六寸（按即多七寸）。用小方的砖，广多二寸，深少三寸（按即多八寸）。用城砖，长广多三寸，深少一寸（按即多一尺一寸），以阔深少一寸（按即多五寸）。广多三寸，以厚广多五分，深多一寸。用六门砖，长广三寸，深多一寸，以阔广多三寸，深多一寸，用厚广多一寸，深多一寸。所有的砖都不要有缝隙，也不要有凸凹不平的地方。如果有需要修补，可以用四种颜色的大方砖，长一尺三寸，小方砖，长一尺一寸，城砖，长一尺二寸，阔六寸，厚二寸五分，六门长一尺，阔五寸，厚二寸。想知道基础的深度和广度怎么计算，按照题意，用一尺三寸的长度量基础的广度，余六寸；用一尺一寸的长度量之，余二寸；用一尺二寸的长度量之，余三寸；用六寸的长度量之，也余三寸；用二寸五分的长度量之，余五分；用一尺的长度量之，余三寸；用五寸的长度量之，也余三寸；用二寸的长度量之，余一寸。求出基础的深度也是同样的方法。
786,问筑堤起四县夫分给里歩皆同齐阔二丈里法三百六十歩歩法五尺八寸人夫以物力差定甲县物力一十三万八千六百贯乙县物力一十四万六千三百贯丙县物力一十九万二千五百贯丁县物力一十八万四千八百贯每力七百七十贯科一名春程人功平方六十尺先到县先给今甲乙二县俱毕丙县余五十一丈丁县余一十八丈不及一日全功欲知堤长及四县夫所筑各几何　　按题意以四县修堤总长相同毎日所修之长不同以各每日所修之长计总长或适足或有余以求总长也但不正言其数而设堤阔数各县物力数一夫力数一夫平方数以取每日所修堤长数故令人不能骤觧,"问筑堤起四县，夫分给里，歩皆同齐，阔二丈，里法三百六十歩，歩法五尺八寸。人夫以物力差定甲县，物力一十三万八千六百贯；乙县，物力一十四万六千三百贯；丙县，物力一十九万二千五百贯；丁县，物力一十八万四千八百贯。每力七百七十贯，科一名春程人功平方六十尺。先到县先给，今甲乙二县俱毕，丙县余五十一丈，丁县余一十八丈，不及一日全功。欲知堤长及四县夫所筑各几何？

按题意，以四县修堤总长相同，每日所修之长不同。以各每日所修之长计总长，或适足或有余，以求总长。但不正言其数，而设堤阔数，各县物力数，一夫力数，一夫平方数，以取每日所修堤长数。故令人不能骤觧。",这段古汉语的意思是：问筑堤起四县，夫分给里步皆同齐阔二丈，里法三百六十步，步法五尺八寸。人夫以物力差定甲县物力一十三万八千六百贯，乙县物力一十四万六千三百贯，丙县物力一十九万二千五百贯，丁县物力一十八万四千八百贯。每力七百七十贯，科一名春程人功平方六十尺。先到县先给，今甲乙二县俱毕，丙县余五十一丈，丁县余一十八丈，不及一日全功。欲知堤长及四县夫所筑各几何。按题意，以四县修堤总长相同，每日所修之长不同，以各每日所修之长计总长，或适足或有余以求总长。但不正言其数而设堤阔数，各县物力数，一夫力数，一夫平方数，以取每日所修堤长数，故令人不能骤解。
787,问有米铺诉被盗去米一般三箩皆适满不记细数今左壁箩剰一合中间箩剰一升四合右壁箩剰一合后获贼系甲乙丙三名甲称当夜摸得马杓在左壁箩舀入布袋乙称踢着木履在中箩舀入袋丙称摸得漆椀在左边箩舀入袋将归食用日乆不知数索到三器马杓满容一升九合木履容一升七合漆椀容一升二合欲知所失米数计赃结几三盗各几何,问：有米铺诉被盗，去米一般，三箩皆适满，不记细数。今左壁箩剩一合，中间箩剩一升四合，右壁箩剩一合。后获贼系甲、乙、丙三名。甲称当夜摸得马杓在左壁箩，舀入布袋；乙称踢着木履在中箩，舀入袋；丙称摸得漆椀在左边箩，舀入袋。将归食用，日久不知数，索到三器：马杓满容一升九合，木履容一升七合，漆椀容一升二合。欲知所失米数，计赃结几，三盗各几何？,"古汉语：問有米鋪訴被盜去米一般三箩皆適滿不記細數今左壁箩剰一合中間箩剰一升四合右壁箩剰一合後獲賊系甲乙丙三名甲稱當夜摸得馬杓在左壁箩舀入布袋乙稱踢著木履在中箩舀入袋丙稱摸得漆椀在左邊箩舀入袋將歸食用日乆不知數索到三器馬杓滿容一升九合木履容一升七合漆椀容一升二合欲知所失米數計贓結幾三盜各幾何

现代汉语：有人在米铺报告被盗了一般的三箩米，都装得满满的，具体数量不记得了。现在左边的箩子剩下一合，中间的箩子剩下一升四合，右边的箩子剩下一合。后来抓到了三个贼，分别叫甲、乙、丙。甲说当晚摸到了马杓，从左边的箩子舀了米装进布袋里；乙说当晚踢着木履，从中间的箩子舀了米装进袋子里；丙说当晚摸到了漆椀，从左边的箩子舀了米装进袋子里。将这些米归来准备食用，但是不知道具体数量，于是找到了三个器具：马杓容量一升九合，木履容量一升七合，漆椀容量一升二合。想知道失去的米的数量，计算一下就可以了。"
788,问军师获几当早几差急足三名徃都下节节走报具甲于前数日申末到乙后数日未正到丙于今日辰未到据供甲日行三百里乙日行二百四十里丙日行一百八十里问自军前至都里数及三人各行日数几何,问军师，获几当早？几差急足？三名徃都下，节节走报具。甲于前数日申末到，乙后数日未正到，丙于今日辰未到。据供，甲日行三百里，乙日行二百四十里，丙日行一百八十里。问自军前至都里数及三人各行日数几何？,这句话的现代汉语翻译是：问军师，从早到晚有多少时间差，急足三名往都下节节走，报告前几天甲到，后几天乙到，今天丙还没到。据甲供述，他行了三百里，乙行了二百四十里，丙行了一百八十里。请问从军队出发到都里的距离，以及三个人分别行了多少天？
789,问有急足三名甲日行三百里乙日行二百五十里丙日行二百里先差丙徃他处下文字旣两日又有文字遣乙追付已半日复有文字续令甲赶付乙三人偶不相及乃同时俱至彼所先欲知乙果及丙甲果及乙得日并里次问彼处去此里数各几何　　按题意谓三行迟疾不同乙后丙两日甲后乙半日问几日几里可以追及又旣及之后三人不能同行及各至彼处之时刻皆与各起程之时刻相同盖言自此至彼所行皆为整日数也,"问：有急足三名，甲日行三百里，乙日行二百五十里，丙日行二百里。先差丙往他处，下文字。既两日，又有文字遣乙追，付已半日，复有文字续，令甲赶付。乙三人偶不相及，乃同时俱至彼所。先欲知乙果及丙，甲果及乙得日并里次。问彼处去此里数各几何？

按题意，谓三行迟疾不同，乙后丙两日，甲后乙半日。问几日几里可以追及？又既及之后，三人不能同行，及各至彼处之时刻，皆与各起程之时刻相同。盖言自此至彼所行皆为整日数也。

（注：此文为《孙子算经》中的一道题目，原文无标点符号。）

答：有急足三名，甲日行三百里，乙日行二百五十里，丙日行二百里。先差丙往他处，下文字。既两日，又有文字遣乙追，付已半日，复有文字续，令甲赶付。乙三人偶不相及，乃同时俱至彼所。先欲知乙果及丙，甲果及乙得日并里次。问彼处去此里数各几何？

按题意，谓三行迟疾不同，乙后丙两日，甲后乙半日。问几日几里可以追及？又既及之后，三人不能同行，及各至彼处之时刻，皆与各起程之时刻相同。盖言自此至彼所行皆为整日数也。","“问有急足三名，甲日行三百里，乙日行二百五十里，丙日行二百里。先差丙往他处下文字，既两日又有文字遣乙追付已半日，复有文字续，令甲赶付乙。三人偶不相及，乃同时俱至彼所。先欲知乙果及丙，甲果及乙得日并里次。问彼处去此里数各几何？”

这道题目的意思是：有三个人，他们的速度不同，分别是甲、乙、丙。甲每天可以行走300里，乙每天可以行走250里，丙每天可以行走200里。现在，先让丙去另一个地方下文字，两天后，又有文字让乙去追丙，已经过了半天，然后又有文字让甲去追乙。但是，三个人并没有在同一时间相遇，而是同时到达了目的地。现在，问乙和丙相遇的时间和地点，以及甲和乙相遇的时间和地点。最后，问目的地离出发地分别有多远。

这道题目需要用到数学知识和推理能力，需要认真分析每个人的行程和时间，才能得出正确的答案。"
790,问太史测验天道庆元四年戊午岁冬至三十九日九十二刻四十五分绍定三年庚寅岁冬至三十二日九十四刻一十二分欲求中间嘉泰甲子岁气骨岁余斗分各得几何　　按绍定三年庚寅之冬至实绍定四年辛夘之始辛夘距戊午三十四年积年为三十三,"问：太史，测验天道庆元四年戊午岁冬至三十九日九十二刻四十五分，绍定三年庚寅岁冬至三十二日九十四刻一十二分，欲求中间嘉泰甲子岁气骨岁余斗分各得几何？

按照古代的时间计算方法，需要用到天文学知识。这段话的意思是，想要求出嘉泰甲子年的岁气和骨岁，以及余下的斗分，需要知道庆元四年戊午岁冬至和绍定三年庚寅岁冬至之间的时间差，即距离。其中，绍定三年庚寅之冬至实际上是绍定四年辛夘之始，辛夘距离戊午三十四年，积年为三十三。因此，需要计算出这段时间的天数，再根据天数计算出岁气、骨岁和斗分。",“问太史测验天道庆元四年戊午岁冬至三十九日九十二刻四十五分绍定三年庚寅岁冬至三十二日九十四刻一十二分欲求中间嘉泰甲子岁气骨岁余斗分各得几何。”的意思是：“请问太史，测验天道庆元四年戊午岁冬至三十九日九十二刻四十五分和绍定三年庚寅岁冬至三十二日九十四刻一十二分之间，中间的嘉泰甲子岁气骨岁余斗分各是多少？按照绍定三年庚寅的冬至，实际上是绍定四年辛夘的开始，辛夘距离戊午已经过去了三十四年，所以积年为三十三。”
791,问开禧历以嘉泰四年甲子岁天正冬至为一十一日【日辰乙亥】四十四刻六十一分五十四杪十一月经朔一日【日辰乙丑】七十五刻五十五分六十二杪问闰骨闰率各几何,问：开禧历以嘉泰四年甲子岁，天正冬至为一十一日【日辰乙亥】，四十四刻六十一分五十四杪。十一月经朔一日【日辰乙丑】，七十五刻五十五分六十二杪。问：闰骨、闰率各几何？,这段古文的意思是：询问开禧历中，嘉泰四年甲子岁天正冬至是在十一月十一日（日辰为乙亥）的第44刻61分54秒55毫秒，一月初一（日辰为乙丑）的第75刻55分62秒55毫秒。同时询问闰月的位置和闰年的频率各是多少。
792,问开禧历积年七百八十四万八千一百八十三欲知推演之原调日法求朔余朔率斗分岁率岁闰入元岁入闰朔定骨闰泛骨闰缩纪率气元率元闰元数及气等率因率蔀率朔等数因数蔀数朔积年二十三事各几何,问：开禧历积年七百八十四万八千一百八十三，欲知推演之原，调日法求朔，余朔率斗分，岁率岁闰入，元岁入闰，朔定骨闰泛，骨闰缩纪，率气元，率元闰元，数及气等率，因率蔀率朔等数，因数蔀数朔，积年二十三事各几何？,这句话的现代汉语翻译是：“如果你想知道如何推算开禧历的原始调日法和求朔余朔率、斗分岁率、岁闰入元、岁入闰朔、定骨闰、泛骨闰、缩纪率、气元率、元闰元数以及气等率等因数，那么需要了解二十三个事项的具体内容。”
793,问岁星合伏经一十六日九十分行三度九十分去曰一十三度乃见后顺行一百一十三日一十十七度八十三分乃留欲知合伏段晨疾初段常度初行率末行率平行率各几何　　按此以两积曰之递差积度求各行率也盖合伏初日其行最疾以次渐迟迟极则留总其积度略如递减差分故古法皆以其术歩之,问岁星合伏，经一十六日九十分行三度九十分，去曰一十三度，乃见后。顺行一百一十三日，一十十七度八十三分，乃留。欲知合伏段晨疾，初段常度，初行率，末行率，平行率各几何？按此以两积曰之，递差积度求各行率也。盖合伏初日，其行最疾，以次渐迟，迟极则留。总其积度，略如递减差分。故古法皆以其术歩之。,"""问岁星合伏经一十六日九十分行三度九十分去曰一十三度乃见后顺行一百一十三日一十十七度八十三分乃留欲知合伏段晨疾初段常度初行率末行率平行率各几何。按此以两积曰之递差积度求各行率也。盖合伏初日其行最疾，以次渐迟，迟极则留，总其积度略如递减差分。故古法皆以其术步之。""

意思是：询问岁星合伏的经过，从第16日90分开始行走3度90分，到第113日10分时行走了117度83分，然后停留。想知道合伏段晨时的速度、初段常度、初行率、末行率和平行率各是多少。按照这个问题，可以用两个积的递差积度来求出各行率。因为合伏初日行走最快，以后逐渐减慢，最后停留，总的积度略微递减，所以古代的方法都是用步数来计算的。"
794,问历代测景惟唐大衍历最密本朝崇天历阳城冬至景一丈二尺七寸一分五十杪夏至景一尺四寸七分七十杪九系与大衍历同今开禧历临安府冬至景一丈八寸二分二十五杪夏至景九寸一分欲求临安府夏至后差几日而景与阳城夏至日等较以大衍历晷景所差尺寸各几何,问：历代测景，惟唐大衍历最密。本朝崇天历，阳城冬至景一丈二尺七寸一分五十杪，夏至景一尺四寸七分七十杪，九系与大衍历同。今开禧历，临安府冬至景一丈八寸二分二十五杪，夏至景九寸一分。欲求临安府夏至后差几日，而景与阳城夏至日等。较以大衍历晷景所差尺寸各几何？,"这段古文的现代汉语翻译如下：

问历代测定太阳视位置的历法中，唐代的大衍历最为精密。本朝使用的崇天历，冬至时阳城的太阳视位置高度为一丈二尺七寸一分五十杪，夏至时高度为一尺四寸七分七十杪。这个历法与大衍历相同，现在使用的开禧历在临安府，冬至时太阳视位置高度为一丈八寸二分二十五杪，夏至时高度为九寸一分。想要求出临安府夏至后与阳城夏至日相比，太阳视位置相差几天，以及与大衍历相比，太阳视位置相差多少尺寸。"
795,问今州郡多有天池盆以测雨水但知以盆中之水为得雨之数不知器形不同则受雨多少亦异未可以所测便为平地得雨之数假今盆口径二尺八寸底径一尺二寸深一尺八寸接雨水深九寸欲求平地雨防防何,问：今州郡多有天池盆，以测雨水。但知以盆中之水为得雨之数，不知器形不同，则受雨多少亦异。未可以所测，便为平地得雨之数。假今盆口径二尺八寸，底径一尺二寸，深一尺八寸，接雨水深九寸。欲求平地雨防防何？,这句话的现代汉语翻译是：“问今天气多少，州郡中有多少天池盆用来测量雨水。只知道用盆中的水来计算雨量，不知道不同形状的器具受到的雨水量也不同，所以不能准确测量。假设现在盆的口径是2尺8寸，底径是1尺2寸，深度是1尺8寸，接收雨水的深度是9寸，想要知道平地上的雨量应该如何计算？”
796,问以圆竹箩验雪箩口径一尺六寸深一尺七寸底径一尺二寸雪防其中高一尺箩体通风受雪多则平地少欲知平地雪高防何　　按箩体通风一语与算术不相涉或箩口所降之雪归于箩底与前天池测雨题相同然依上步算平地雪深只七寸余今其数又不合殆故为是语以误人也,问以圆竹箩验雪箩，口径一尺六寸，深一尺七寸，底径一尺二寸。雪防其中，高一尺。箩体通风，受雪多则平地少。欲知平地雪高防何？按箩体通风一语与算术不相涉。或箩口所降之雪归于箩底，与前天池测雨题相同。然依上步算，平地雪深只七寸余。今其数又不合，殆误人。故为是语，以误人也。,这段古汉语的意思是：用圆竹箩和雪箩来测量雪的深度和高度。圆竹箩的口径为一尺六寸，深度为一尺七寸，底径为一尺二寸，雪箩的高度为一尺，可以通风，防止雪进入。如果箩体通风，受到的雪就会比平地少，想知道平地雪的高度和如何防止雪。但是，箩体通风与算术无关，箩口所降的雪也不会归于箩底。这段话中的“平地雪高防何”是有误的，因为按照之前的计算，平地雪深只有七寸余，这个数字也不正确，可能是误导人的。
797,问以圆罂接雨口径一尺五寸腹径二尺四寸底径八寸深一尺六寸并里明接得雨水深一尺二寸圆法用密率问平地雨水深防何　　按此题问平地雨深无关圆法密率句赘若求罂中雨积数则当加此语,问：以圆罂接雨，口径一尺五寸，腹径二尺四寸，底径八寸，深一尺六寸。并里明接得雨水，深一尺二寸。圆法用密率，问平地雨水深防何？按此题，问平地雨深无关圆法密率，句赘。若求罂中雨积数，则当加此语。,这句话的现代汉语翻译是：“问一个直径为一尺五寸，腹径为二尺四寸，底径为八寸，深度为一尺六寸的圆形罂，接到雨水后，里面的水深为一尺二寸。用圆法和密率计算，问在平地上，防止雨水深度达到多少。”如果要求罂中雨水的积数，需要加上“罂中雨积数为多少？”这句话。
798,问验雪占年墙高一丈二尺倚木去址五尺梢与墙齐木身积雪厚四寸峻积薄平积厚欲知平地雪厚几何,问验雪，占年墙高一丈二尺。倚木去址五尺梢与墙齐，木身积雪厚四寸，峻积薄，平积厚。欲知平地雪厚几何？,这句话的现代汉语翻译是：“问验雪占年，墙高一丈二尺，倚木去址五尺梢与墙齐，木身积雪厚四寸，峻积薄，平积厚。欲知平地雪厚几何？”
799,问有方中古圆池堙圮北余一角从外方隔斜至内圆边七尺六寸欲就古迹修之欲求圆方方斜各几何,问有方中古圆池，堙圮北余一角，从外方隔斜至内圆边七尺六寸。欲就古迹修之，欲求圆方方斜各几何。,这句话的现代汉语翻译是：问有一个方形中有一个古老的圆形池塘，北边的一角已经坍塌，从外面到内圆边斜着隔了七尺六寸，想要修复这个古迹，想知道圆形、方形、斜线各自的几何形状。
800,问有两尖田一叚其尖长不等两大斜三十九歩两小斜二十五歩中广三十歩欲知其积几何,问：有两尖田，一叚。其尖长不等，两大斜三十九歩，两小斜二十五歩，中广三十歩。欲知其积几何？,这句话的现代汉语翻译是：“问有两个尖田，一个平行四边形，其两个尖的长度不相等，两个斜边分别为39步和25步，中间的宽度为30步，求其面积是多少？”
801,问沙田一叚有三斜其小斜一十三里中斜一十四里大斜一十五里里法三百歩欲知为田几何,问沙田一叚，有三斜。其小斜一十三里，中斜一十四里，大斜一十五里。里法三百步。欲知为田几何？,这句话的现代汉语翻译是：“问沙田一块地，有三条斜线，其中小斜线长13里，中斜线长14里，大斜线长15里。按里程计算，这块地的面积是多少？”
802,问有荡一所正北阔一十七里自南尖穿径中长二十四里东南斜二十里东北斜一十五里西斜二十六里欲知亩积几何,"问：有荡一所，正北阔一十七里，自南尖穿径中长二十四里，东南斜二十里，东北斜一十五里，西斜二十六里。欲知亩积几何？

注：这段古文是在描述一个地理位置，询问其面积大小。

注意到这段古文中没有标点符号，我们需要根据语义和语法来添加标点符号，使其更加易读易懂。下面是我添加的标点符号：

问：有荡一所，正北阔一十七里，自南尖穿径中长二十四里，东南斜二十里，东北斜一十五里，西斜二十六里。欲知亩积几何？",这句话的现代汉语翻译是：问有一块土地，从南尖到北边宽17里，中间穿过一条径线，长24里，向东南斜着走20里，向东北斜着走15里，向西斜着走26里。请问这块土地的面积是多少亩？
803,问沙洲一叚形如棹力广一千九百二十歩从三十六百歩大斜二千五百歩小斜一千八百二十歩以安集民每户给一十五亩欲知地积容民几何,问沙洲一叚，形如棹力，广一千九百二十歩。从三十六百歩大斜，二千五百歩小斜，一千八百二十歩以安集民。每户给一十五亩。欲知地积容民几何？,这句话的现代汉语翻译是：问沙洲一条形如船的河道，宽一千九百二十步，从三十六百步大斜，二千五百步小斜，一千八百二十步以安置居民，每户分配十五亩土地。想知道这片土地的面积和容纳居民的数量是多少。
804,问蕉叶田一叚中长五百七十六歩中广三十四歩不知其周求积亩合几何,问蕉叶田一叚中，长五百七十六歩，中广三十四歩，不知其周，求积亩合几何？,这句话的现代汉语翻译是：问蕉叶田一块长五百七十六步，宽三十四步，不知道它的周长是多少，求它的面积是多少亩，属于哪种几何形状。
